<?xml version="1.0" encoding="UTF-8"?>
<po:Potvrda xmlns:po="http:///www.ftn.uns.ac.rs/vakcinacija/potvrda"
    xmlns:ct="http:///www.ftn.uns.ac.rs/vakcinacija/commonTypes" xmlns:xsi="http://www.w3.org/2001/XMLSchema-instance" 
    xsi:schemaLocation="http:///www.ftn.uns.ac.rs/vakcinacija/potvrda potvrda.xsd">
    <po:Sifra>VAX-123</po:Sifra>
    <po:LicneInformacije>
        <po:PunoIme>
            <ct:Ime>Petar</ct:Ime>
            <ct:Prezime>Markovic</ct:Prezime>
        </po:PunoIme>
        <po:DatumRodjenja>1990-08-01</po:DatumRodjenja>
        <po:Pol>Muski</po:Pol>
        <po:JMBG>3553355353532</po:JMBG>
    </po:LicneInformacije>
    <po:InformacijeOVakcinacijama>
        <po:BrojDoze>1</po:BrojDoze>
        <po:DatumDavanja>2021-02-02</po:DatumDavanja>
        <po:Serija>PFI-55609</po:Serija>
    </po:InformacijeOVakcinacijama>
    <po:InformacijeOVakcinacijama>
        <po:BrojDoze>2</po:BrojDoze>
        <po:DatumDavanja>2021-03-02</po:DatumDavanja>
        <po:Serija>PFI-66609</po:Serija>
    </po:InformacijeOVakcinacijama>
    <po:InformacijeOVakcinacijama>
        <po:BrojDoze>3</po:BrojDoze>
        <po:DatumDavanja>2021-10-02</po:DatumDavanja>
        <po:Serija>SINO-76609</po:Serija>
    </po:InformacijeOVakcinacijama>
    <po:ZdravstvenaUstanova>DOM ZDRAVLJA NOVI SAD</po:ZdravstvenaUstanova>
    <po:VakcinaPrveDveDoze>Pfizer-BioNTech</po:VakcinaPrveDveDoze>
    <po:Vakcine>
        <po:BrojDoze>3</po:BrojDoze>
        <po:Vakcina>Sinopharm</po:Vakcina>
    </po:Vakcine>
    <po:DatumIzdavanja>2021-05-05</po:DatumIzdavanja>
    <po:QR>http://www.ftn.uns.ac.rs/</po:QR>
</po:Potvrda>
